{
  "presetName": "Outer 16\" Front",
  "version": "2.0",
  "timestamp": "2025-12-03T02:02:21.414Z",
  "dimensions": {
    "width": 390.5,
    "height": 395.5,
    "thickness": 39,
    "unit": "mm"
  },
  "texts": [
    {
      "id": "text-1764604507180",
      "content": "lunnen.pro",
      "style": "text",
      "position": {
        "column": 12,
        "row": 18,
        "baseline": 5
      },
      "width": 1,
      "alignment": "right",
      "textAlign": "right",
      "alignmentMode": "baseline",
      "showBounds": false,
      "visible": true,
      "lockPosition": true,
      "plane": "front"
    }
  ],
  "grid": {
    "module": 2.7883,
    "margins": 4.9202,
    "marginsUnit": "mm",
    "columns": 12,
    "rows": 19,
    "rowHeight": 6,
    "linkMode": "module",
    "locks": {
      "module": false,
      "margins": false,
      "moduleValue": null,
      "marginsValue": null
    },
    "visibility": {
      "columns": true,
      "rows": true,
      "baseline": true
    }
  },
  "colors": {
    "background": "#2353DB"
  },
  "typography": {
    "units": {
      "size": "mod",
      "lineHeight": "mod"
    },
    "headline": {
      "size": 2,
      "lineHeight": 2.5,
      "tracking": -0.015,
      "useXHeight": false,
      "fontWeight": 500
    },
    "text": {
      "size": 0.75,
      "lineHeight": 1,
      "tracking": 0,
      "useXHeight": false,
      "fontWeight": 500
    },
    "caption": {
      "size": 0.5,
      "lineHeight": 1,
      "tracking": 0,
      "useXHeight": false,
      "fontWeight": 500
    },
    "lunnenDisplay": {
      "size": 3,
      "lineHeight": 4,
      "tracking": 0,
      "useXHeight": false
    }
  },
  "display": {
    "dimensions": false,
    "labels": false,
    "sidePanels": true,
    "objects": true
  },
  "graphics": {
    "blocks": [
      {
        "id": "graphics-logo",
        "name": "lunnen_logo",
        "position": {
          "column": 1,
          "row": 0,
          "baseline": 0
        },
        "height": 18.86,
        "widthInColumns": 12,
        "widthInModules": null,
        "sizeMode": "width",
        "originalWidth": 195.7229156,
        "originalHeight": 28.3464565,
        "alignment": "left",
        "showBounds": false,
        "visible": true,
        "lockPosition": true,
        "svg": "<defs>\n    <style>\n      .logo-fill {\n        fill: currentColor;\n      }\n    </style>\n  </defs>\n  <!-- Generator: Adobe Illustrator 30.0.0, SVG Export Plug-In . SVG Version: 2.1.1 Build 123)  -->\n  <defs xmlns=\"http://www.w3.org/2000/svg\">\n    <style>\n      .st0 {\n        fill: currentColor;\n      }\n    </style>\n  </defs>\n  <path xmlns=\"http://www.w3.org/2000/svg\" id=\"lunnen_x5F_logo\" class=\"logo-fill\" d=\"M9.0881491,22.8576832h17.6819773v5.4887733H8.727479c-5.8183193,0-8.727479-3.0299931-8.727479-9.0881481V0h5.713963v19.2583084c0,1.349308.2471595,2.286684.7414784,2.8121262.49615.523613,1.3731089.7872486,2.6327076.7872486ZM117.2982712,22.0026951c0,.4192562-.1116791.7579556-.3368683,1.0124378s-.5327682.3826389-.9227295.3826389c-.5400925,0-.9758224-.2709599-1.3053665-.8110504l-11.1130295-18.9415779c-1.5287247-2.6693234-3.7055664-4.0039849-6.5231857-4.0039849-2.1914825,0-3.8849792.6059987-5.0859985,1.8216577-1.1991806,1.2138281-1.7996902,2.9329605-1.7996902,5.1519041l.0457687,15.3879728c0,.4192562-.1116791.7579556-.3368683,1.0124397s-.5327682.3826389-.9227295.3826389c-.5712128,0-1.0197601-.2709599-1.3493118-.8110504l-11.0690842-18.9415779c-1.5305557-2.6693234-3.7055664-4.0039849-6.5250092-4.0039849-2.1896515,0-3.8849792.6059987-5.0841675,1.8216577-1.1991806,1.2138281-1.7996864,2.9329605-1.7996864,5.1519041v21.7317343h5.7139626V6.4334722c0-.4192557.1135101-.756125.3386993-1.0106082s.5309372-.3826394.9227295-.3826394c.5986786,0,1.049057.2691293,1.3493118.8092189l11.0690842,18.9415779c1.5287247,2.671154,3.6890869,4.0058155,6.4774094,4.0058155,2.1896515,0,3.8849792-.60783,5.0859909-1.8234882,1.1991806-1.2138271,1.7996902-2.9311295,1.7996902-5.1519032V6.4334722c0-.4192557.1116791-.756125.3368683-1.0106082s.5327682-.3826394.9227295-.3826394c.5986786,0,1.049057.2691293,1.3493118.8092189l11.1130295,18.9415779c1.5305557,2.671154,3.690918,4.0058155,6.4792404,4.0058155,2.1896515,0,3.8849792-.60783,5.0841675-1.8234882,1.1991806-1.2138271,1.7996902-2.9311295,1.7996902-5.1519032V0h-5.7139664s0,22.0026951.0000076,22.0026951ZM52.0572968,14.1741438c0,1.9498148-.3460236,3.606698-1.0344086,4.9706545-.6902161,1.3657856-1.7026558,2.4001942-3.0373154,3.1050568s-2.9476051,1.0563774-4.8370056,1.0563774-3.5023422-.3515167-4.8370056-1.0563774-2.3470993-1.7392712-3.0373154-3.1050568c-.6902161-1.3639545-1.0344086-3.0208397-1.0344086-4.9706535V0h-5.7139626v14.5329828c0,2.7901564.6133213,5.2654142,1.8436279,7.4239416,1.2303047,2.1603584,2.9476051,3.8410435,5.1519051,5.0402241,2.2061272,1.1991825,4.7472954,1.7996883,7.6271629,1.7996883s5.421032-.6005058,7.6271629-1.7996883c2.2042961-1.1991825,3.9216003-2.8798656,5.1519051-5.0402241,1.2284737-2.1585274,1.8436279-4.6337852,1.8436279-7.4239407V0h-5.7139626s0,14.1741438-.0000076,14.1741438ZM157.3436127,6.6824627c1.3493042,2.2335901,2.0248718,4.7454643,2.0248718,7.5356207,0,.7195091-.0457764,1.4408484-.1354828,2.1603575h-25.0152893c.1416626,1.1197701.4577026,2.1793518,1.1012268,3.1270256.8238678,1.213829,1.9644623,2.175005,3.4199524,2.8798676,1.4536591.7048626,3.0959015,1.0563774,4.926712,1.0563774,1.6184387,0,3.1270294-.2984219,4.52211-.8989277,1.3932495-.6005058,2.4807434-1.4097252,3.2606812-2.4294872h7.1090393c-1.1991882,2.7883263-3.1197052,4.956007-5.7579041,6.5012131-2.6400299,1.5452042-5.6846771,2.3159771-9.1339264,2.3159771-3.0299988,0-5.7377625-.6297989-8.1214752-1.8893986-2.3855438-1.2595978-4.2456512-2.9988689-5.580307-5.2196445-1.3346558-2.2189426-2.0010757-4.7381401-2.0010757-7.5575905s.66642-5.3551235,2.0010757-7.6051917c1.3346558-2.2482367,3.1947632-4.0039849,5.580307-5.2635837,2.3837128-1.2595984,5.0914917-1.8893976,8.1214752-1.8893976,2.9988708,0,5.6919861.6371225,8.0757141,1.9113674,2.3855438,1.2760758,4.2529755,3.0299931,5.6022797,5.2654142l.0000153.000001ZM135.3189545,8.8867598c-.5309296.7803831-.8275299,1.6422377-1.0167847,2.5411663h18.9463806c-.192688-.8989286-.4945526-1.7607832-1.0348663-2.5411663-.8403473-1.2156591-2.0102386-2.1676807-3.5096588-2.8578968-1.4994354-.688385-3.1801147-1.0344086-5.0383911-1.0344086-1.8308105,0-3.473053.3460236-4.926712,1.0344086-1.4554901.6902161-2.5960846,1.6422381-3.4199524,2.8578968h-.0000153ZM190.0089569,0v22.0026951c0,.4192562-.1116791.7579556-.3368683,1.0124378s-.5327606.3826389-.9227295.3826389c-.3002472,0-.5620575-.0677395-.7872467-.2032204s-.4137573-.3368702-.5620575-.60783l-9.809494-18.9415779c-.6902161-1.3200152-1.5909729-2.3178074-2.7004547-2.993377-1.1094666-.6737387-2.3690643-1.010608-3.7787933-1.010608-2.1896515,0-3.8849792.6059987-5.0841675,1.8216577-1.1991882,1.2138281-1.7996826,2.9329605-1.7996826,5.1519041v21.7317343h5.7139587V6.4334722c0-.4192557.1135101-.756125.3368683-1.0106082.2251892-.2544827.5327606-.3826394.9227295-.3826394.6005096,0,1.0508881.2691293,1.3511353.8092189l9.807663,18.9415779c.6902161,1.321846,1.5891418,2.3178082,2.7004547,2.9933777,1.1094666.6737385,2.3690643,1.0124378,3.7787933,1.0124378,2.1896515,0,3.8849792-.60783,5.0841675-1.8234882,1.1991882-1.2138271,1.7996826-2.9311295,1.7996826-5.1519032V0h-5.7139587Z\"/>\n",
        "plane": "front"
      },
      {
        "id": "graphics-1764604244742",
        "name": "yf_claim",
        "position": {
          "column": 1,
          "row": 18,
          "baseline": 3
        },
        "height": 3,
        "widthInColumns": 1.8,
        "widthInModules": null,
        "sizeMode": "height",
        "originalWidth": 186.2242584,
        "originalHeight": 28.3464565,
        "alignment": "left",
        "showBounds": false,
        "visible": true,
        "lockPosition": true,